{
 "id": "280410b3-5328-5f28-b691-6f14f1bc7d7b",
 "objectType": "solar_field",
 "ambitions": [
  "energy"
 ],
 "areaOfInterest": {
  "geometry": {
   "type": "Polygon",
   "coordinates": [
    [
     [
      38724.26288639335,
      338025.9632591611
     ],
     [
      49247.790930799965,
      337798.2268477276
     ],
     [
      50304.23919936622,
      388965.82966383826
     ],
     [
      39885.86698641784,
      389191.9992272146
     ],
     [
      38724.26288639335,
      338025.9632591611
     ]
    ]
   ]
  },
  "crs": "EPSG:28992"
 },
 "policyStage": "programming",
 "effortBudget": {
  "maxSubagents": 8,
  "maxCostEur": 0.0,
  "maxLatencyS": 900
 },
 "requestedAt": "2026-08-30T08:36:00Z",
 "requestedBy": "poc-integration",
 "parameters": {
  "opstelling": "grond_of_water",
  "scopeNote": "zonneveld per Bijlage I definitie van CVDR704250: elke groepering van zonnepanelen op of boven de grond of op het wateroppervlak; dakopstellingen vallen buiten dit objecttype",
  "aoiSourceId": "poc-nspd-bbox",
  "aoiNote": "NSPD-werkbbox-deel (jurisdictie), bbox.py NSPD_BBOX_WGS84, deterministisch gegenereerd"
 }
}
