{
 "id": "6d52efb4-7cce-5295-8a24-fe76780c09e6",
 "objectType": "soil_activity",
 "ambitions": [
  "water_safety"
 ],
 "areaOfInterest": {
  "geometry": {
   "type": "Polygon",
   "coordinates": [
    [
     [
      19081.264272646396,
      338508.8466273117
     ],
     [
      38724.26288639335,
      338025.9632591611
     ],
     [
      39885.86698641784,
      389191.9992272146
     ],
     [
      20439.16262104726,
      389671.56007398583
     ],
     [
      19081.264272646396,
      338508.8466273117
     ]
    ]
   ]
  },
  "crs": "EPSG:28992"
 },
 "policyStage": "programming",
 "effortBudget": {
  "maxSubagents": 8,
  "maxCostEur": 0.0,
  "maxLatencyS": 900
 },
 "requestedAt": "2026-10-04T17:30:00Z",
 "requestedBy": "poc-integration",
 "parameters": {
  "aoiSourceId": "poc-nspd-bbox",
  "aoiNote": "NSPD-werkbbox-deel (jurisdictie), bbox.py NSPD_BBOX_WGS84, deterministisch gegenereerd"
 }
}
