{
 "id": "e28886cf-6b65-58ac-b21f-c9d35c0886ec",
 "objectType": "riparian_development",
 "ambitions": [
  "water_safety"
 ],
 "areaOfInterest": {
  "geometry": {
   "type": "Polygon",
   "coordinates": [
    [
     [
      19081.264272646396,
      338508.8466273117
     ],
     [
      38724.26288639335,
      338025.9632591611
     ],
     [
      39885.86698641784,
      389191.9992272146
     ],
     [
      20439.16262104726,
      389671.56007398583
     ],
     [
      19081.264272646396,
      338508.8466273117
     ]
    ]
   ]
  },
  "crs": "EPSG:28992"
 },
 "policyStage": "programming",
 "effortBudget": {
  "maxSubagents": 8,
  "maxCostEur": 0.0,
  "maxLatencyS": 900
 },
 "requestedAt": "2026-10-04T10:00:00Z",
 "requestedBy": "poc-integration",
 "parameters": {
  "minCapacityMw": 3,
  "aoiSourceId": "poc-nspd-bbox",
  "aoiNote": "NSPD-werkbbox-deel (jurisdictie), bbox.py NSPD_BBOX_WGS84, deterministisch gegenereerd"
 }
}