{
 "id": "bb0f4127-a61a-5127-8a72-9863c24bb1d7",
 "objectType": "forest_planting",
 "ambitions": [
  "nature",
  "climate_adaptation"
 ],
 "areaOfInterest": {
  "geometry": {
   "type": "Polygon",
   "coordinates": [
    [
     [
      38724.26288639335,
      338025.9632591611
     ],
     [
      49247.790930799965,
      337798.2268477276
     ],
     [
      50304.23919936622,
      388965.82966383826
     ],
     [
      39885.86698641784,
      389191.9992272146
     ],
     [
      38724.26288639335,
      338025.9632591611
     ]
    ]
   ]
  },
  "crs": "EPSG:28992"
 },
 "policyStage": "programming",
 "effortBudget": {
  "maxSubagents": 8,
  "maxCostEur": 0.0,
  "maxLatencyS": 900
 },
 "requestedAt": "2026-08-30T08:37:00Z",
 "requestedBy": "poc-integration",
 "parameters": {
  "realisatiewijze": "vrijwillige_omvorming",
  "scopeNote": "nieuwe natuur / bosaanplant binnen het zoekgebied (Groene contour, art. 6.4 CVDR704250); gerealiseerde natuur wordt toegevoegd aan het Natuurnetwerk Nederland",
  "aoiSourceId": "poc-nspd-bbox",
  "aoiNote": "NSPD-werkbbox-deel (jurisdictie), bbox.py NSPD_BBOX_WGS84, deterministisch gegenereerd"
 }
}