{
 "id": "85c8b442-8189-5a0a-8dcc-9eafc01b839a",
 "objectType": "solar_field",
 "ambitions": [
  "energy"
 ],
 "areaOfInterest": {
  "geometry": {
   "type": "Polygon",
   "coordinates": [
    [
     [
      19081.264272646396,
      338508.8466273117
     ],
     [
      38724.26288639335,
      338025.9632591611
     ],
     [
      39885.86698641784,
      389191.9992272146
     ],
     [
      20439.16262104726,
      389671.56007398583
     ],
     [
      19081.264272646396,
      338508.8466273117
     ]
    ]
   ]
  },
  "crs": "EPSG:28992"
 },
 "policyStage": "programming",
 "effortBudget": {
  "maxSubagents": 8,
  "maxCostEur": 0.0,
  "maxLatencyS": 900
 },
 "requestedAt": "2026-08-30T08:36:00Z",
 "requestedBy": "poc-integration",
 "parameters": {
  "aoiSourceId": "arcgis-provinciegrens",
  "aoiServiceUrl": "https://services.arcgis.com/m4kxECHTi6Dj9hfa/arcgis/rest/services/Provinciegrens_Utrecht/FeatureServer",
  "aoiLayerId": 0,
  "aoiLastChecked": "2026-08-30T07:43:11Z",
  "aoiNote": "areaOfInterest geometry embedded verbatim (EPSG:28992) from the province open-data layer Provinciegrens Utrecht; parameters.aoiSourceId records its provenance alias",
  "opstelling": "grond_of_water",
  "scopeNote": "zonneveld per Bijlage I definitie van CVDR704250: elke groepering van zonnepanelen op of boven de grond of op het wateroppervlak; dakopstellingen vallen buiten dit objecttype"
 }
}